checked_at,source,url,key,title,published_at,status,can_comment,comment_count,like_count,posted,readiness,note
2026-06-28T21:53:12+09:00,note_comment_ottogi_mill,https://note.com/kohanaatkitchen/n/n6c024194cdfa,n6c024194cdfa,【調味料の話】加熱せずに食べたい”ちょっといい”ごま油 | 韓国,2026-01-23T04:40:55.000+09:00,published,True,1,14,yes,posted,posted 2026-06-28T16:26+09:00 via logged-in Edge CDP as oilcham; no link; public API 2026-06-28T16:26:48+09:00 shows published can_comment=true comments 1 likes 14; page comment section showed the oilcham comment asking final-aroma use and whether Ottogi 110ml or pressed-date/aroma comparison matters; not response evidence until a third-party reply exists
2026-06-28T21:53:12+09:00,note_comment_korean_mill_aroma,https://note.com/kanshoku_shuto/n/n783033624017,n783033624017,韓国のローカルな地域で韓国本場のごま油を見つけました。,2026-05-13T17:58:25.000+09:00,published,True,1,6,no,ready_not_posted,"comment candidate prepared in 검증/note_댓글_관찰_접촉_패킷_20260628.md; public API 2026-06-28T14:37:57+09:00 shows published and can_comment=true, comments 1, likes 6; asks where Korean fresh-pressed sesame aroma is most useful after bringing it to Japan; hold until at least 6-24h after the first two posted comments or after reply/notification check"
2026-06-28T21:53:12+09:00,note_comment_shinokubo_namul,https://note.com/kikosugar_/n/ne6bf02bdc64b,ne6bf02bdc64b,新大久保のソウル市場で買える、魔法の赤い粉で作るもやしナムル #おつまみレシピ,2022-12-31T23:49:39.000+09:00,published,True,2,45,yes,posted,"posted 2026-06-28T16:30+09:00 via logged-in Edge CDP as oilcham; no link; public API 2026-06-28T16:30:49+09:00 shows published can_comment=true comments 2 likes 45, one higher than the pre-posting snapshot; comment asks whether Shin-Okubo ingredient buyers choose sesame oil as final-aroma oil and whether cheap small bottle, large standard bottle, or fresh-pressed type is easier to choose; not response evidence until a third-party reply exists"
2026-06-28T21:53:12+09:00,note_comment_kimbap,https://note.com/aurea_yakuzen/n/n5d28638b82f0,n5d28638b82f0,韓国海苔巻きキンパ、作ってみた,2023-03-01T16:21:33.000+09:00,published,True,0,2,no,ready_not_posted,"comment candidate added 2026-06-28T15:06:14+09:00; public API shows published and can_comment=true, comments 0, likes 2; asks home kimbap/namul cooks what bottle size they use and whether they care about aroma before use-up; hold until first two comments have had time to receive replies or until home-cooking answers are specifically needed"
2026-06-28T21:53:12+09:00,note_comment_korean_seaweed_gift,https://note.com/minomushi_anju/n/n04f209abaf22,n04f209abaf22,おいしい韓国海苔,2025-05-16T18:11:59.000+09:00,published,True,0,12,no,ready_not_posted,"comment candidate added 2026-06-28T15:06:14+09:00; public API shows published and can_comment=true, comments 0, likes 12; asks whether fresh Korean seaweed aroma implies opened/fresh-made sesame oil difference or only fresh seaweed difference; keep as indirect freshness probe after more direct candidates"
2026-06-28T21:53:12+09:00,note_comment_korea_trip_oil_baggage,https://note.com/mhtkmtbr/n/nacecf2a8abf7,nacecf2a8abf7,【韓国旅】トートバッグに取り憑かれた帰国日当日,2025-09-19T09:13:27.000+09:00,published,True,0,34,no,ready_not_posted,"comment candidate added 2026-06-28T15:06:14+09:00; public API shows published and can_comment=true, comments 0, likes 34; asks what cooking oil was bought in Korea and why it was worth liquid baggage friction; hold as Korea-trip purchase-friction probe because the oil may not be sesame oil"
